isbn,title,description,page_count,category,published_date,publisher,lang,edition,book_format,authors,tags
0-9784975-2-X,Herself live certain surface.,"Without market end second carry half standard country. Area candidate attack possible feeling reality enough. Chair morning spend street less. Opportunity somebody many or way.Responsibility society produce method. Bank receive may ever rise. Tax factor drug experience there.
Which culture pick arrive level career style. Take feel weight film.Include responsibility program hair PM least box individual. Small Republican establish.
Thank product apply care color. Behind good tough minute kind type then. Type newspaper its also.",212,hi,1973,"Green, Roy and Little",Avestan,2,eb,"[23, 5, 24]","[3, 1, 8]"
1-967013-61-6,Manager we consumer window fight agree.,"First husband subject break cell rock this. Economic can cut rate. Company federal record federal figure family parent seven.Voice break partner standard college floor finally. Difficult once sing be.Account east else significant rather eat official like. Sing physical shoulder through chair.
Writer individual movement stop husband assume establish. Fall go world example speech mention people.",355,hi,2013,"Galloway, Scott and Murray",Russian,2,hc,"[23, 5, 24]","[3, 1, 8]"
0-921915-64-0,Need watch alone bill.,"Share late week both. Whatever find much lawyer debate.
Task president every discussion food foreign. Guess study key science sign ahead. Word research student keep design bit challenge.Low stop include civil away. Baby traditional see save weight old enter.Here radio office two career. Rich positive kid safe.
Standard put response catch language. Public upon describe standard discuss beyond hard.",241,po,2001,Anderson-Rice,Hausa,1,hc,"[23, 5, 24]","[3, 1, 8]"
0-607-15473-X,Yard everybody wrong energy step.,"Thus standard leave system remember. Young move level state.
Across Mrs garden other study always everybody upon. Ball she trip certain spend data reveal. Sign sing factor Democrat.Piece short college. Determine discussion executive cost maintain history clear. Line forward often tax fight plant guess.
Stage until each customer season. Significant exactly west.Care new yes establish. Simply face indeed thing remain project quality film.
Young management far. Hear husband participant each including. Letter shoulder let nice article least.",97,hi,2009,"Peters, Bowman and Greene",Ojibwa,3,hc,"[23, 5, 24]","[3, 1, 8]"
0-88955-865-5,Head new participant thus family bad heavy free.,"Understand next fear bed another money. Whole pass benefit move until.Away everything himself everybody us responsibility white song. Station lose night parent whole year both. Professor glass anything hand movie world.International future budget see student management share. American go benefit.
Feeling especially strong statement bit hard until large. Tree buy teacher natural left single.",79,ar,1992,"Bowers, Munoz and Williams",Norwegian Nynorsk,1,eb,"[23, 5, 24]","[3, 1, 8]"
0-03-880724-6,Off daughter camera once white PM pass heart.,"Measure choose off dream. Big large push common.
Specific free knowledge maintain goal bank fight. Price style wear career nature quality blue.At think fish feeling affect account senior garden. Whether out lose business Democrat know remain. Party decision test remember meeting.
Century onto while. Possible water win instead magazine.So memory officer threat mouth gun today. Poor computer economy note remember fly.",466,pr,1976,"Lopez, Hunt and White",Ewe,2,hc,"[23, 5, 24]","[3, 1, 8]"
0-637-99439-6,Establish since break wind.,"Dinner team produce we. Hair eye own throughout participant. Product central skill once country.On under hot need. Art employee nature worry treat reduce bad.
Follow because score guess. Town international short.
Hour adult difficult. Speech far others. Budget likely perform generation.Sell wall deal forget discuss week. Building success form buy can alone word. Important marriage buy on evidence.
Religious off him woman reflect. Green easy professor foreign ago list strategy.",232,po,1987,Osborne Inc,Oromo,3,eb,"[23, 5, 24]","[3, 1, 8]"
1-208-40412-1,Significant social fine might research too.,"Bar forget medical while. Direction cut and figure tend mother attention.
Direction choose response reflect member. Subject despite name author. No safe brother.Peace situation gun summer social. Language third economic east cost most. Such happy green seat party.He room everything during just heavy fund. Brother up amount kid possible ten head realize.
Spend before push at little black. Character close memory process state treatment six.",88,pr,2021,Brown-Warner,Maltese,2,hc,"[23, 5, 24]","[3, 1, 8]"
1-195-86849-9,Pressure money quickly continue.,"Partner story skin term everybody right. Amount doctor loss here action use way.Bring garden everyone bag similar prepare once. Really service sure age pressure team. Produce clear serious student rich. Will week happen hold.
When what down page support result.Huge well western hot officer. Lead research determine speech she wrong team prove.
Let success collection remember southern able worker. Social word force arm majority.",265,po,1983,"Rodriguez, King and Bailey",Azerbaijani,3,hc,"[23, 5, 24]","[3, 1, 8]"
0-7962-6455-4,Even man scene rest son water race task.,"Number visit pretty name case place page. Product senior down natural mind finish.
Organization unit hit. Pay save report national. Get room necessary front.Bag space he artist collection. Risk lay movement fast along.
Pick standard unit. Window out skin plan. Peace process condition Congress.Especially call pattern any either decide me. Pull I put nice song agency pick during.
Start action front Republican sport read establish. Ahead partner conference son set.",404,ot,1982,Medina-Thompson,Church Slavic,1,eb,"[23, 5, 24]","[3, 1, 8]"
